{
  "schema_version": "core.frozen_release_manifest.v9",
  "type": "frozen_release_manifest",
  "release_version": "v11.6.0",
  "status": "candidate",
  "scope": "domain_scale_kernel_v3",
  "inventory_profile": "core.stabilization_release.v11_6_0_candidate",
  "critical_subsystems": [
    "dsk_v3",
    "contract_program_v2",
    "executable_contracts",
    "release_integrity"
  ],
  "self_reference_policy": "manifest_file_excluded_fingerprint_covers_inventory",
  "canonicalization": "core.canonical_json.v1",
  "hash_algorithm": "sha256",
  "created_at": "2026-09-07T03:17:05Z",
  "artifact_count": 203,
  "artifacts": [
    {
      "path": ".github/workflows/publish-v11-6.yml",
      "role": "ci",
      "file_sha256": "sha256:a31f46d6908e832408d9befdcec77c336e2ec988a6b8bd8aeb736c71a50d088e"
    },
    {
      "path": ".github/workflows/replay-certification.yml",
      "role": "ci",
      "file_sha256": "sha256:d7054dae6d257ad1c6c29479c8bc681a050e7f5fbfe3676328cd13893e501377"
    },
    {
      "path": "CHANGELOG.md",
      "role": "release_metadata",
      "file_sha256": "sha256:3484c8a5b3abcc94ce0090ea8eaba7fbf3a88b01e770a4a025e9ea40fb69d5a8"
    },
    {
      "path": "LICENSE",
      "role": "release_metadata",
      "file_sha256": "sha256:51703b538b721846bc0157e7883501e179196df89a76963b7d2d56b79030e30c"
    },
    {
      "path": "README.md",
      "role": "documentation",
      "file_sha256": "sha256:3798a75c128e6a9664924a6a2107fed3f4db1fdc184cc7a0fd97decfcca111ba"
    },
    {
      "path": "contracts/CoreRuleAnchor.abi.json",
      "role": "contract",
      "file_sha256": "sha256:ee6f16b73aa75ae2d34f7925c1f08e9589be9870a1cc6c998b9c3befff953542"
    },
    {
      "path": "contracts/CoreRuleAnchor.bin",
      "role": "contract",
      "file_sha256": "sha256:c979e051176e05c75f0d6d280c0bc873b465f9403846e784d2cf3d9df7eabf0b"
    },
    {
      "path": "contracts/CoreRuleAnchor.build.json",
      "role": "contract",
      "file_sha256": "sha256:64f79b8de0896671ac0f1dcbea56b858501fb68393641d1af33feb0beb351edb"
    },
    {
      "path": "contracts/CoreRuleAnchor.runtime.bin",
      "role": "contract",
      "file_sha256": "sha256:5acb4bd825098ca7133a3867b43263bb8798659114f5bb9b945c623be30f8aae"
    },
    {
      "path": "contracts/CoreRuleAnchor.sol",
      "role": "contract",
      "file_sha256": "sha256:f56416a86f39a156a7c3b38cb4bc30a71624be43b6a7912242f6c369893d8f29"
    },
    {
      "path": "core_runtime/__version__.py",
      "role": "release_metadata",
      "file_sha256": "sha256:a88bf48899e396a97ff8000d4d73bb4633de6588428a76f93cd01067bfea2f36"
    },
    {
      "path": "core_runtime/cli/__init__.py",
      "role": "release_metadata",
      "file_sha256": "sha256:da4b0d5d05d13f5f1edf81328e76f9ba4abe4e7b8db062ec4d9ad6fdcdd000c8"
    },
    {
      "path": "core_runtime/cli/main.py",
      "role": "runtime",
      "file_sha256": "sha256:4508671689bbc4a2647bf68ef95747e7b4f83617107c317cbaa4e52580bea670"
    },
    {
      "path": "core_runtime/core/__init__.py",
      "role": "runtime",
      "file_sha256": "sha256:f16d7357faba99f55ef8581f7b9497a570c4afa9e4b732cece4efa7e6ae5f955"
    },
    {
      "path": "core_runtime/core/audit_event.py",
      "role": "runtime",
      "file_sha256": "sha256:e416a7ab492a0c8af74a55f40052f4d2cb5656d50ce3a692f476f6791020bfb0"
    },
    {
      "path": "core_runtime/core/canonicalization.py",
      "role": "runtime",
      "file_sha256": "sha256:d1869ce432f94dbf18e513d87f62845b9fa4ff3843a6f521782b06bf30beec83"
    },
    {
      "path": "core_runtime/core/contract_evaluator.py",
      "role": "runtime",
      "file_sha256": "sha256:8b77152dabade5b5353233b78fcaeb4e390dde2804087ccd6d0d09fe3e61ecfa"
    },
    {
      "path": "core_runtime/core/contract_executability.py",
      "role": "runtime",
      "file_sha256": "sha256:43693036f9509141276aeac23c5df0d823a1d48ed06bcd6b26a5ebb5c8e675d6"
    },
    {
      "path": "core_runtime/core/contract_loader.py",
      "role": "runtime",
      "file_sha256": "sha256:d218b2aaa428c9d323ba1c7755004cda3bd5edbd2ae2a83789d001d16b7680dc"
    },
    {
      "path": "core_runtime/core/contract_probes.py",
      "role": "runtime",
      "file_sha256": "sha256:e7717cda3c609a6033aa6cbca8c1f9daa582989da825cf43a290dd0b2180a5d1"
    },
    {
      "path": "core_runtime/core/contract_program.py",
      "role": "runtime",
      "file_sha256": "sha256:653a4f0a835530cd482b5e25d3f044c3395e97f6c8872c19e2d369f157cc3041"
    },
    {
      "path": "core_runtime/core/contract_program_v2.py",
      "role": "runtime",
      "file_sha256": "sha256:9fa1e20ceb619cfdf989b1b7be5c1ed07fe74735347e956d502ec8089edb65e5"
    },
    {
      "path": "core_runtime/core/dsk_v3.py",
      "role": "runtime",
      "file_sha256": "sha256:91b63c1d16f48d4755b083a5c3373c4295caeb602fe1a9630f5cd596b1f85f9f"
    },
    {
      "path": "core_runtime/core/rule_anchor.py",
      "role": "runtime",
      "file_sha256": "sha256:3efe434044dcebbcd5fe3a36346bf7a1efa679de5a79d7588482516c385e2ce1"
    },
    {
      "path": "core_runtime/tooling/bump_version.py",
      "role": "runtime",
      "file_sha256": "sha256:10f60149286293c6d3d21c5a6a2d108da042e2c723b0877026134a58337f99c8"
    },
    {
      "path": "core_runtime/tooling/file_inventory.py",
      "role": "runtime",
      "file_sha256": "sha256:0f79a28d4d8d8eb9f6ec62826d82f3d870662902f3795f5de689594eb784d3af"
    },
    {
      "path": "docs/CORE_RELEASE_README.md",
      "role": "documentation",
      "file_sha256": "sha256:09db00bece8ffefa8e8527bba4ada99b50ffb99e81c8cfe012384a3b9b8bc624"
    },
    {
      "path": "docs/EXECUTABLE_CONTRACTS_AND_PHYSICAL_SAFETY.md",
      "role": "documentation",
      "file_sha256": "sha256:37dd88604aa362e7be0995ae1fbc98dcfca490e105435047c3d02e96cc9ab8de"
    },
    {
      "path": "docs/FROZEN_RULE_ANCHORING.md",
      "role": "documentation",
      "file_sha256": "sha256:7f3e37f72b9b6c1c0099a152928477c02952612f35341258ccb65c9855439f55"
    },
    {
      "path": "docs/PROJECTION_AND_RESPONSIBLE_AGENCY.md",
      "role": "documentation",
      "file_sha256": "sha256:3ef3f54b29e4938022d10dca8f4e1916ca69557ce5eb45e70bf74d9dcd1d4d93"
    },
    {
      "path": "docs/REPRODUCIBILITY.md",
      "role": "documentation",
      "file_sha256": "sha256:e62bd5e70d527c22651cfe1ccc9fac408f323c6782c4d03d96a54e970942bc29"
    },
    {
      "path": "docs/VERSIONING_POLICY.md",
      "role": "documentation",
      "file_sha256": "sha256:f0bb685673ae54e7e789b857653a903666bb5f7d00bfadf6383ee483eb00b908"
    },
    {
      "path": "docs/releases/README.md",
      "role": "documentation",
      "file_sha256": "sha256:bbd7302e01235438ac0f66aa607aa8b69b4afdc4ba1107b9c0afdd2e30543e3b"
    },
    {
      "path": "docs/releases/v11.1.0.md",
      "role": "documentation",
      "file_sha256": "sha256:5e22abbee2872b4ab9051c574b1ab77b4e3d419f28f1aea6c446d572a7c0c9f7"
    },
    {
      "path": "docs/releases/v11.3.0-candidate.md",
      "role": "documentation",
      "file_sha256": "sha256:54359604dd76f08915d1e1062d697de849a08e543ad0b4b5cf91747492cef025"
    },
    {
      "path": "docs/releases/v11.4.0-candidate.md",
      "role": "documentation",
      "file_sha256": "sha256:a3bcf936ecf1ae8ace30f057ce52065d8484e63c0ac4b605a6f8777743c553fb"
    },
    {
      "path": "docs/releases/v11.5.1.md",
      "role": "documentation",
      "file_sha256": "sha256:2f9fed415cf2a812f7a2856b8b457c2e754a2a27af68e06c8a068ae64d8326c1"
    },
    {
      "path": "docs/releases/v11.6.0.md",
      "role": "documentation",
      "file_sha256": "sha256:af99f7e90fceccbc379c29b2120a649afce092393c06620eff7108d73a0092fd"
    },
    {
      "path": "examples/anchoring/accepted_freeze_artifact.json",
      "role": "example",
      "file_sha256": "sha256:9425bf666b56bb2602b7fe1f22af31c9b1e18937c41931fbdffd1c99ff004431"
    },
    {
      "path": "examples/anchoring/accepted_release_manifest.json",
      "role": "example",
      "file_sha256": "sha256:4bc6c300663ec5ae0397af1c43190ad6490eee0c17b1afa7da230991c11871bf"
    },
    {
      "path": "examples/anchoring/chain_adapters/arbitrum_one_valid.json",
      "role": "example",
      "file_sha256": "sha256:b0322a2ce91ee0a73cda3d68b1915d0f30c05304262de4d8bcf7e6c0ecb40021"
    },
    {
      "path": "examples/anchoring/chain_adapters/ethereum_sepolia_valid.json",
      "role": "example",
      "file_sha256": "sha256:c8e98ae2d1dc3b2b2e8f5e503d3fd6ffa553c88212347205c23da44232499a3b"
    },
    {
      "path": "examples/anchoring/chain_adapters/local_devnet_valid.json",
      "role": "example",
      "file_sha256": "sha256:0676bd552b180ae53f0e843a0c9328c3eb31f3fc92417167e101e545394d4d35"
    },
    {
      "path": "examples/anchoring/chain_adapters/polygon_mainnet_valid.json",
      "role": "example",
      "file_sha256": "sha256:64764a39b5bc7c1205b1759640647a9d2c08a25d4dcec823f36d2cf603a33a0d"
    },
    {
      "path": "examples/anchoring/chain_adapters/rejected_fingerprint_mismatch.json",
      "role": "example",
      "file_sha256": "sha256:b89c5467e65eeb42fd1bfe235722ea64a630fff7468333c99bbd4e23bd55ca33"
    },
    {
      "path": "examples/anchoring/chain_adapters/rejected_local_rpc_mainnet.json",
      "role": "example",
      "file_sha256": "sha256:cd551053a8f377fa9544a92123fcfbd078a91861f06993c2c9878ab95f2ccdd4"
    },
    {
      "path": "examples/anchoring/chain_adapters/rejected_mainnet_low_confirmations.json",
      "role": "example",
      "file_sha256": "sha256:1d9b78064733a26556b7d6dcbd305e4d056313a2c118892ae8430013484dadc7"
    },
    {
      "path": "examples/anchoring/chain_adapters/rejected_unsupported_family.json",
      "role": "example",
      "file_sha256": "sha256:a6c49e177a85d5c08bb30ad104aae99b67d0c62691c77496a029dc39b24a73e9"
    },
    {
      "path": "examples/anchoring/rejected_hash_mismatch.json",
      "role": "example",
      "file_sha256": "sha256:3daed04e153a4d932515fa857abc02b90f1648c0c40d0cc5a6af7e2848611390"
    },
    {